<?xml version="1.0" encoding="UTF-8"?>

<html xmlns:xsi="http://www.w3.org/2001/XMLSchema-instance" xsi:noNamespaceSchemaLocation="ejercicio3.xsd">
    <section>
        <headline size="2">Ejemplo de XML</headline>
        <ul>
            <li> datos estructurados </li>
            <li> intercambio de datos </li>
        </ul>
    </section>
    <section>
        <headline size="3">Otro ejemplo</headline>
        <ul>
            <li> datos opcionales </li>
            <li> esquemas opcionales </li>
            <li> un solo elemento ra√≠z </li>
        </ul>
    </section>
</html>